{
  "schema_version": 1,
  "case_id": "item-parent.check-link-on-ground.underwater",
  "scenario": "Link is in an Ages underwater map with ordinary in-air and swimming bytes clear.",
  "routine": {
    "name": "checkLinkOnGround",
    "source": "object_code/common/itemParents/commonCode.s",
    "locations": {
      "ages": "06:54C4",
      "seasons": "06:5416"
    }
  },
  "expected_relation": "campaign-policy",
  "policy_hook": "is_link_considered_grounded",
  "observations": [
    {
      "campaign": "ages",
      "rom_sha256": "0b56b78a9e45452e98c33edd111234931f1e034dc097f6f23082eb8db6055474",
      "routine_location": "06:54C4",
      "capture_status": "planned"
    },
    {
      "campaign": "seasons",
      "rom_sha256": "862a51368fb30539279d336b3fe193b43876d2cb15c87a36f5da517804ab3971",
      "routine_location": "06:5416",
      "capture_status": "planned"
    }
  ],
  "notes": [
    "Capture zflag and the Link/companion fields used by both branches.",
    "Seasons has no equivalent underwater-map branch; document its canonical control case."
  ]
}
